{"id":"p1","title":"p1","background":{"type":"blank"},"objects":[{"id":"img-popup","x":10,"y":10,"type":"image","assetId":"c1:jf3zbfd5izthmdhdr46ab2csy4","width":120,"height":90,"presentation":{"open":"popup","label":"চিত্র ১"}},{"id":"img-icon","x":150,"y":10,"type":"image","assetId":"c1:jf3zbfd5izthmdhdr46ab2csy4","width":120,"height":90,"displayMode":"icon","presentation":{"open":"fullscreen","icon":"eye","accent":"#1F4D8F"}},{"id":"model-live","x":10,"y":120,"type":"embed","embed":"model3d","width":400,"height":300,"assetId":"c1:coilbff3mf2zxa37zmewz5j7je","poster":"c1:jf3zbfd5izthmdhdr46ab2csy4","presentation":{"show":"live","label":"স্ক্রু গজ","icon":"ruler","accent":"#2f6f4e","autoRotate":true}},{"id":"video","x":420,"y":120,"type":"embed","embed":"video","width":320,"height":180,"url":"https://media.example.org/pendulum.mp4","poster":"c1:jf3zbfd5izthmdhdr46ab2csy4","presentation":{"show":"live","open":"popup","autoplay":true,"loop":true,"muted":true}},{"id":"audio","x":420,"y":320,"type":"embed","embed":"audio","width":320,"height":60,"url":"https://media.example.org/fork.mp3","presentation":{"label":"সুরশলাকা","autoplay":true,"loop":true}},{"id":"lab-full","x":100,"y":100,"type":"embed","embed":"plugin","width":960,"height":540,"poster":"c1:jf3zbfd5izthmdhdr46ab2csy4","presentation":{"open":"fullscreen","icon":"atom"},"plugin":"chalk.lab","lab":{"id":"org.chalk-format.examples.pendulum","version":"1.0.0","title":"Simple pendulum · সরল দোলক","entry":"c1:6ka3wp2wdbp6dzuau5iwyecdza","assets":["c1:coilbff3mf2zxa37zmewz5j7je"],"params":{"length":0.8,"swings":10,"readings":3},"capabilities":["state","progress","assets"]}},{"id":"later","x":760,"y":120,"type":"embed","embed":"model3d","width":200,"height":200,"assetId":"c1:coilbff3mf2zxa37zmewz5j7je","displayMode":"icon","presentation":{"show":"hologram","open":"sideways","icon":"telescope","sparkle":true}}]}